{
  "protocol": "https://headlessempire.com/network/registry/0.1",
  "registry_id": "https://headlessempire.com/network/registry.json",
  "name": "Headless Empire Bootstrap Registry",
  "updated_at": "2026-07-16T02:19:07Z",
  "policy_url": "https://headlessempire.com/network/policy",
  "members": [
    {
      "id": "https://now.mikesblog.com/.well-known/headless-empire.json",
      "manifest_url": "https://now.mikesblog.com/.well-known/headless-empire.json",
      "status": "active",
      "verification_level": "unverified",
      "first_seen_at": "2026-07-15T11:51:19Z",
      "last_checked_at": "2026-07-16T02:19:07Z",
      "manifest_updated_at": "2026-07-15T12:21:29Z"
    }
  ],
  "registries": []
}
